"id","site","timestamp","year","place","dataset","exists","digital","public","online","free","machinereadable","bulk","openlicence","uptodate","url","format","licenseurl","dateavailable","officialtitle","publisher","reviewed","reviewResult","reviewComments","details","isCurrent","isOpen","submitter","reviewer","score"
"0bb3c1cf-6c90-4864-95b5-a5989c51c936","us-city","2014-02-21T21:44:28","2014","slc","assessment","Yes","Yes","Yes","Yes","No","Yes","Yes",,"Yes","http://assessor.slco.org/html/DATA.html","Excel",,,,"County of Salt Lake","Yes","Yes",,,"Yes","No","Kris Trujillo","Kris Trujillo","55"
"3e1a1273-e240-42b8-a675-62f85911c112","us-city","2015-02-21T20:54:26","2015","nashville","construction-permits","Yes","Yes","Yes","Yes","Yes","Yes","Yes",,"Yes","https://data.nashville.gov/Development-and-Housing/Building-Permits/3h5w-q8b7","JSON","https://data.nashville.gov/Development-and-Housing/Building-Permits/3h5w-q8b7",,,"Metro Codes via Houston Runion","Yes","Yes",,"Data set is was create by Houston Runion.

Data Provided By
Metro Codes Department

Source Link
http://codes.nashville.gov

License
Public Domain","Yes","Yes","John Chapin","John Chapin","100"
"aa926b83-e1dc-4fdc-ba7d-d85691b7307c","us-city","2015-02-21T21:06:41","2015","nashville","code-enforcement","Yes","Yes","Yes","Yes","Yes","Yes","Yes",,"Yes","https://data.nashville.gov/Development-and-Housing/Property-Standards-Violations/479w-kw2x?category=Development-and-Housing&view_name=Property-Standards-Violations","JSON","https://data.nashville.gov/Development-and-Housing/Property-Standards-Violations/479w-kw2x?category=Development-and-Housing&view_name=Property-Standards-Violations",,,"Metro Codes Department via Houston Runion","Yes","Yes",,"Property-Standards-Violations-Metadata.docx

Licensing and Attribution
Data Provided By
Metro Codes Department

Source Link
http://codes.nashville.gov

License
Public Domain","Yes","Yes","John Chapin","John Chapin","100"
"bc5cb245-8fd5-4773-a234-6408fefcf70d","us-city","2014-05-13T01:03:42","2014","miami","business-listings","Unsure","Unsure","Unsure","Unsure","Unsure","Unsure","Unsure",,"Unsure","http://www.miamidade.gov/licenses/",,,,,"Miami-Dade County","Yes","Yes",,"Only licensed contractor search is available. No download of data and no data could be found for other licensed professions like mechanics or locksmiths.","Yes","No","Joey Daoud","Joey Daoud","0"
"9d62e517-eb49-42c3-84b9-eb28564c8ee4","us-city","2015-07-30T19:52:50","2015","williamsburg","budget","Yes","Yes","Yes","Yes","Yes","Yes","Yes",,"Yes","http://google.com",,"http://google.com",,,,"Yes","Yes",,"TEST","Yes","Yes","Andrew Hyder",,"100"
"cc6f1e5f-0664-4623-b9c9-6d80fd11ab3a","us-city","2016-06-09T20:52:34","2016","baltimore","code-enforcement","Unsure","Unsure","Unsure","Unsure","Unsure","Unsure","Unsure",,"Unsure",,,,,,,"Yes","Yes","Dataset does not appear to be on Open Baltimore site (data.baltimorecity.gov).",,"Yes","No","Richard Yarrow","Richard Yarrow","0"
"17413ed0-06d4-4730-8201-6beda36e15e7","us-city","2016-06-09T20:48:02","2016","baltimore","business-listings","Unsure","Unsure","Unsure","Unsure","Unsure","Unsure","Unsure",,"Unsure",,,,,,,"Yes","Yes","Datasets do not appear to be on the Open Baltimore site (data.baltimorecity.gov).",,"Yes","No","Richard Yarrow","Richard Yarrow","0"
"4cf13965-523c-44a2-9ddf-23f5c210ea69","us-city","2016-06-09T20:46:05","2016","baltimore","construction-permits","Yes","Yes","Yes","Yes","Yes","Yes","Yes",,"Yes","https://data.baltimorecity.gov/browse?sortBy=relevance&tags=permits&utf8=%E2%9C%93","CSV JSON PDF RDF RSS XLS XLSX XML","http://www.baltimorecity.gov/node/2020",,,"Open Baltimore","Yes","Yes"," ",,"Yes","Yes","Richard Yarrow","Richard Yarrow","100"
"ca6a4004-539f-4c4d-a3a3-a7fa89325521","us-city","2016-06-09T20:36:51","2016","baltimore","food-safety","Yes","Yes","Yes","Yes","Unsure","No","No",,"Yes","http://baltimore.foodinspectionreports.com/",,,,"Food Facility Inspection Reports","Baltimore City Health Department","Yes","Yes"," ","The website notes that ""Inspection reports dated earlier than January 1, 2016 may be obtained by filling a Maryland Public Information Act (MPIA) request with the Department. Copy fees may apply.""","Yes","No","Richard Yarrow","Richard Yarrow","30"
"587b4a91-5016-42dc-b036-668434e5cc13","us-city","2016-06-08T19:59:15","2016","baltimore","budget","Unsure","Unsure","Unsure","Unsure","Unsure","Unsure","Unsure",,"Unsure",,,,,,,"Yes","Yes",,,"Yes","No","anonymous","anonymous","0"
"f577490e-6b55-4f28-9277-62f6f54335af","us-city","2016-04-21T22:00:27","2016","austin","deeds","Yes","Yes","Yes","Yes","Yes","No","No",,"Yes","http://traviscountyclerk.org/eclerk/Content.do?code=Recording",,"http://traviscountyclerk.org/eclerk/Content.do?code=RecordSearchDisclaimer",,"Property Deed and Property Information","Travis County","Yes","Yes","The data is available in digital form, though not available in bulk or data machine readable","The data is available in digital form, though not available in bulk or data machine readable","Yes","No","Mireya Galarza","Robert Quatier","75"
"a2c4046e-2340-4525-815b-30c91a2f4bac","us-city","2016-05-16T21:45:14","2016","austin","asset-disclosure","Yes","Yes","No","Unsure","Yes","No","No",,"Unsure",,,,,"Personal Financial Statements","State of Texas and City of Austin","Yes","Yes","As noted above, Texas State code restricts the distribution of Personal Finance Statements of Elected officials to Public Requests. So the data exists is available in digital form and is free. Though, because of the requirements of a Public Request, this data set does not meet the other requirements","While this data is collected and available by public information request, no openly posted dataset is available to the public.

Texas State code restricts the distribution Personal Financial Statements of Elected Officials to Public Requests.

https://www.ethics.state.tx.us/statutes/ch572.htm#572.032

","Yes","No","Mireya Galarza","Robert Quatier","25"
"73db1891-7152-46e2-9a28-e787ad7a77de","us-city","2016-04-19T20:55:23","2016","austin","contracts","Yes","Yes","Yes","Yes","Yes","Yes","Yes",,"Yes","https://austintexas.gov/financeonline/contract_catalog/index.cfm","CSV","http://austintexas.gov/page/city-austin-open-data-terms-use",,"Contract Catalog.  Information about City's authorized spending limit, contract lifetime (called inception-to-date) ordering and spending. Contracts are visible only while active. For the purposes of the Online Contract Catalog Flat File, a contract is a long-term (multi-year) contract for goods and services, and contracts for Construction activity. Within the City, these are referred to as Master Agreements and Central Purchase Contracts.","City of Austin Financial Services","Yes","Yes","The Procurement Contracts information meets all the requirements and the url where the data is available makes it easy to search for specific contracts",,"Yes","Yes","Julia Robbins","Robert Quatier","100"
"54edef78-6864-470f-8b6a-02be0db0d24b","us-city","2016-04-14T22:04:54","2016","austin","construction-permits","Yes","Yes","Yes","Yes","Yes","Yes","Yes",,"Yes","https://data.austintexas.gov/Permitting/Issued-Construction-Permits/3syk-w9eu","CSV","http://www.austintexas.gov/coa-open-data-licensing",,"City of Austin Construction Permits starting from 1969 to present, that also include permits from the year 1921. Includes Building, Electrical, Mechanical, Plumbing, and Driveway/Sidewalk Permits. Includes relevant details such as issue date, location, council district, expiration date, description of work, square footage, valuation, and units.","City of Austin Planning & Development Review","Yes","Yes","Accepting this submission because after reviewing the data, this data set meets all the criteria.","The City of Austin has started publishing all of it's construction permit data to its open data portal. The data is updated daily and includes permits dating back to the 1970s.","Yes","Yes","John Clary","Robert Quatier","100"
"13a9dfef-a3d6-4ac1-9bf9-700246e9b3f5","us-city","2016-06-03T12:57:32","2016","columbus","parcels","Yes","Yes","Yes","Yes","Yes","Yes","Yes",,"Yes","ftp://apps.franklincountyauditor.com/GIS_Shapefiles/2016/03/20160316_parcel.zip","shapefiles",,,"Parcel Shape Files","Franklin County Auditor (","Yes","Yes",,"The data is available on the Franklin County Auditor's site through FTP and is updated regularly:

* Shapefiles: ftp://apps.franklincountyauditor.com/GIS_Shapefiles/
* CSV: ftp://apps.franklincountyauditor.com/Parcel_CSV/

There is also an online tool which can show individual parcels (including a map): http://property.franklincountyauditor.com/_web/search/commonsearch.aspx?mode=parid

License terms are not stated.","Yes","No","Nicholas Tietz","Nicholas Tietz","70"
"c47bfbf4-6822-42dc-9d6c-60bfcad100ba","us-city","2016-05-26T20:27:50","2016","baltimore","asset-disclosure","Yes","Unsure","Unsure","Yes","Yes","Yes","Yes",,"Yes","https://data.baltimorecity.gov/browse?category=City%20Government","CSV, JSON, PDF, RDF, RSS, XLS, XLSX, XML","http://www.baltimorecity.gov/node/2020",,,"Open Baltimore","Yes","Yes",,"Employee salary data is available online in digital form, but other disclosures might not be digitized and might only be available from the City Hall building.","Yes","No","anonymous","anonymous","90"
"142e804d-64c7-4d22-880a-2219c01d3290","us-city","2016-05-26T20:08:54","2016","baltimore","parcels","Yes","Yes","Yes","Yes","Yes","Yes","Yes",,"Yes","https://data.baltimorecity.gov/browse?category=Geographic&q=parcels&sortBy=relevance&tags=parcel&utf8=%E2%9C%93","CSV","http://www.baltimorecity.gov/node/2020",,,"Open Baltimore","Yes","Yes",,"Main parcels page ([https://data.baltimorecity.gov/Geographic/Parcels/rb22-mgti][1]) updated very recently, but other parcel pages updated less recently (2014 or 2015).


  [1]: https://data.baltimorecity.gov/Geographic/Parcels/rb22-mgti","Yes","Yes","anonymous","Richard Yarrow","100"
"b460c9c3-c0ab-4233-b7de-3d2774bb6efa","us-city","2016-05-26T19:42:00","2016","baltimore","service-requests","Yes","Yes","Yes","Yes","Yes","Yes","Yes",,"Yes","https://data.baltimorecity.gov/browse?tags=311&utf8=%E2%9C%93","CSV, JSON, PDF, RDF, RSS, XLS, XLSX, XML","http://www.baltimorecity.gov/node/2020",,,"Open Baltimore","Yes","Yes",,"Data included is very new or timely, including data from the same day.","Yes","Yes","anonymous","anonymous","100"
"3c746fa9-dcdc-428b-8793-63d0401c8214","us-city","2016-05-26T19:31:59","2016","baltimore","crime-stats","Yes","Yes","Yes","Yes","Yes","Yes","Yes",,"Yes","https://data.baltimorecity.gov/browse?sortBy=relevance&tags=crime&utf8=%E2%9C%93","CSV, JSON, PDF, RDF, RSS, XLS, XLSX, XML","http://www.baltimorecity.gov/node/2020",,,"Open Baltimore","Yes","Yes",,,"Yes","Yes","Richard Yarrow","Richard Yarrow","100"
"4815ec48-3490-4c6e-99e1-398c77fd8b30","us-city","2016-05-26T19:08:19","2016","baltimore","lobbyist","Unsure","Unsure","Unsure","Unsure","Unsure","Unsure","Unsure",,"Unsure",,,,,,,"Yes","Yes",,,"Yes","No","anonymous","anonymous","0"
"64f28d3a-7464-4888-9043-3f438bf52b36","us-city","2016-05-26T19:05:57","2016","baltimore","web-analytics","Unsure","Unsure","Unsure","Unsure","Unsure","Unsure","Unsure",,"Unsure",,,,,,,"Yes","Yes",,,"Yes","No","anonymous","anonymous","0"
"a2b6d34a-3dde-4e99-b3e8-d336920b7293","us-city","2016-05-26T01:47:58","2016","columbus","transit","Yes","Yes","Yes","Yes","Yes","Yes","Yes",,"Yes","http://www.cota.com/COTA/media/COTAContent/OpenGTFSData.zip","CSV",,,"COTA GTFS Feed. This dataset contains the standard GTFS data.","COTA","Yes","Yes",,"Access to the data is fairly self explanatory and it is available from http://www.cota.com/data. 

The real-time location information is one thing I'm a bit unsure of, just not familiar with the format it is in. The site does offer a download of it, but I don't know how to parse it so I can't validate that the data is there.

The data appears to be timely; the most recent GIS data dump is from January 2016 (http://www.cota.com/COTA/media/COTAContent/Jan2016_COTA_GIS.zip).

The data is not openly licensed. From the terms of use: ""Any other use, including reproduction, modification, distribution, transmission, republication, display or performance, is strictly prohibited without the express written consent of COTA."" This prevents it from meeting the Open Definition.","Yes","No","Nicholas Tietz","Nicholas Tietz","70"
"7234483a-5edd-488a-a3b2-1f1f22c89632","us-city","2016-05-18T22:18:36","2016","sanfrancisco","public-buildings","Yes","Yes","Yes","Yes","Yes","Unsure","Yes",,"Yes","https://data.sfgov.org/Geographic-Locations-and-Boundaries/San-Francisco-City-Lands-Current-Zipped-Shapefile-/nt8v-6azn",,"https://data.sfgov.org/Property/San-Francisco-City-Lands-Current-Zipped-Shapefile-/nt8v-6azn",,"San Francisco City Lands - Current (Zipped Shapefile Format); Current San Francisco City Lands - properties owned by the City and County of San Francisco.","Technology / SF Gov Webmaster","Yes","Yes",,"Shapefile is nice, there's also a table in DBF format, which can be converted to CSV pretty easily by opening the file in open office (or similar) and then 'save as' to csv (or xslx or whatever).

The table doesn't make it easy to find the address of every piece of property (lumped in the same column as the name, in parens). The 'department' field is ambiguous too and probably needs to be joined to another table.","Yes","No","Brian Mikol","Brian Mikol","85"
"558ef04f-5435-4867-bd00-fcadfc942573","us-city","2016-05-19T23:07:38","2016","batonrouge","web-analytics","Yes","Yes","Yes","Yes","Yes","Yes","Yes",,"Yes","https://data.brla.gov/Government/Website-Analytics/n9u7-h9i7","CSV","https://data.brla.gov/terms-of-service",,"BRGov.com Web Traffic Stats","Department of Information Services","Yes","Yes",,"Web traffic statistics for the primary City-Parish website, brgov.com, with data provided by Google Analytics.","Yes","Yes","anonymous","anonymous","100"
"29124f08-2fba-4ccc-903f-96902623f996","us-city","2016-05-17T18:11:36","2016","newyorkcity","deeds","Yes","Yes","Yes","Yes","Yes","Yes","Yes",,"Yes","https://data.cityofnewyork.us/City-Government/ACRIS-Real-Property-Master/bnx9-e6tj","CSV, XLS, XML, JSON, RSS, RDF, XML","http://www1.nyc.gov/home/terms-of-use.page",,"ACRIS","Department of Finance (DOF)","Yes","Yes",,,"Yes","Yes","anonymous","anonymous","100"
"21cca848-0e33-4ed7-beda-33c951c44796","us-city","2016-05-17T18:06:35","2016","newyorkcity","public-buildings","Yes","Yes","Yes","Yes","Yes","Yes","Yes",,"Yes","https://data.cityofnewyork.us/City-Government/City-owned-and-Leased-Property/4e2n-s75z","CSV, JSON, PDF, RDF, RSS, XLS, XLSX, XML","http://www1.nyc.gov/home/terms-of-use.page",,"City-owned and Leased Property","NYC Department of Citywide Administrative Services","Yes","Yes",,,"Yes","Yes","anonymous","anonymous","100"
"20b6cb21-aee6-4375-8714-39c178472aae","us-city","2016-05-16T22:32:40","2016","newyorkcity","code-enforcement","Yes","Yes","Yes","Yes","Yes","Yes","Yes",,"Yes","https://data.cityofnewyork.us/d/jz4z-kudi","CSV, JSON, PDF, RDF, RSS, XLS, XLSX, XML","http://www1.nyc.gov/assets/doitt/downloads/pdf/nyc_open_data_tsm.pdf",,"OATH ECB Hearings Case Status - alleged public safety and quality of life violations that are filed and adjudicated through the City’s administrative law court","NYC Office of Administrative Trials & Hearings","Yes","Yes",,,"Yes","Yes","Andrew Nicklin","Andrew Nicklin","100"
"00c60670-26e6-4418-8cf8-2b3292c0106c","us-city","2016-05-16T22:22:17","2016","newyorkcity","lobbyist","Yes","Yes","Yes","Yes","Yes","Yes","Yes",,"Yes","http://www1.nyc.gov/nyctp/home.htm","CSV","http://www1.nyc.gov/nyctp/home.htm",,"New York City Transparency Project","Office of the City Clerk","Yes","Yes",,,"Yes","Yes","Andrew Nicklin","Andrew Nicklin","100"
"66354f8c-6f39-4550-8411-1accc4c86db5","us-city","2016-05-16T22:20:28","2016","newyorkcity","campaign-finance","Yes","Yes","Yes","Yes","Yes","Yes","Yes",,"Yes","http://www.nyccfb.info/searchabledb/","CSV, XLS, PDF","http://www.nyccfb.info/searchabledb/",,"NYC Campaign Contribution data","NYC Campaign Finance Board","Yes","Yes",,,"Yes","Yes","Andrew Nicklin","Andrew Nicklin","100"
"a44e260c-194f-40eb-92f5-6540d107cb22","us-city","2016-05-16T22:17:58","2016","newyorkcity","assessment","Yes","Yes","Yes","Yes","Yes","Yes","Yes",,"Yes","http://www1.nyc.gov/site/planning/data-maps/open-data/dwn-pluto-mappluto.page","CSV, Shapefile","http://www1.nyc.gov/site/planning/data-maps/open-data/dwn-pluto-mappluto.page",,"PLUTO and MapPLUTO","NYC Department of City Planning","Yes","Yes",,,"Yes","Yes","Andrew Nicklin","Andrew Nicklin","100"
"c4256cfc-61c3-48a8-992d-f5d452ec940f","us-city","2016-05-16T22:10:03","2016","newyorkcity","food-safety","Yes","Yes","Yes","Yes","Yes","Yes","Yes",,"Yes","https://data.cityofnewyork.us/d/43nn-pn8j","CSV, JSON, XLS, XLSX, PDF, RDF, JSON","http://www1.nyc.gov/assets/doitt/downloads/pdf/nyc_open_data_tsm.pdf",,"DOHMH New York City Restaurant Inspection Results","Department of Health and Mental Hygiene (DOHMH)","Yes","Yes",,,"Yes","Yes","Andrew Nicklin","Andrew Nicklin","100"
"7c5a3436-059b-4f8f-8762-79306676e47c","us-city","2016-05-16T22:06:48","2016","newyorkcity","service-requests","Yes","Yes","Yes","Yes","Yes","Yes","Yes",,"Yes","https://data.cityofnewyork.us/d/erm2-nwe9","CSV, JSON, PDF, RDF, RSS, XLS, XLSX, XML, API","http://www1.nyc.gov/assets/doitt/downloads/pdf/nyc_open_data_tsm.pdf",,"311 Service Requests from 2010 to Present","NYC 311","Yes","Yes",,,"Yes","Yes","Andrew Nicklin","Andrew Nicklin","100"
"fc521d6f-38c8-44da-94df-ac853d5b4c65","us-city","2016-05-16T22:04:26","2016","newyorkcity","business-listings","Yes","Yes","Yes","Yes","Yes","Yes","Yes",,"Yes","https://data.cityofnewyork.us/d/w7w3-xahh","JSON, XML, XLS, RSS, CSV, RDF, PDF, XLSX","http://www.nyc.gov/html/doitt/html/open/local_law_11_2012.shtml",,"Legally Operating Businesses","NYC Department of Consumer Affairs","Yes","Yes",,"updated weekly","Yes","Yes","Andrew Nicklin","Andrew Nicklin","100"
"fb4b1ac5-8048-4515-9c12-e392868a08e1","us-city","2016-05-16T22:02:34","2016","newyorkcity","construction-permits","Yes","Yes","Yes","Yes","Yes","Yes","Yes",,"Yes","https://data.cityofnewyork.us/d/xfyi-uyt5","CSV, JSON, PDF, RDF, RSS, XLS, XLSX, XML","http://www1.nyc.gov/home/terms-of-use.page",,"Multi Agency Permits","NYC Department of Buildings and Department of Health","Yes","Yes",,"data is updated daily","Yes","Yes","Andrew Nicklin","Andrew Nicklin","100"
"2ee4651a-02d6-40f4-ba26-55f1feea2e23","us-city","2016-05-16T21:38:39","2016","newyorkcity","crime-stats","Yes","Yes","Yes","Yes","Yes","Yes","Yes",,"Yes","https://data.cityofnewyork.us/d/hyij-8hr7","Excel, PDF, CSV, JSON","http://www1.nyc.gov/assets/doitt/downloads/pdf/nyc_open_data_tsm.pdf",,"NYPD 7 Major Felony Incidents","NYPD & NYC DOITT","Yes","Yes",,"This data is being updated quarterly and is available at the incident level.","Yes","Yes","Andrew Nicklin","Andrew Nicklin","100"
"528db747-7dfb-4c06-b644-2a2d6bb11aef","us-city","2016-05-14T22:21:48","2016","batonrouge","asset-disclosure","Yes","Yes","Yes","Yes","Yes","Yes","Yes",,"Yes","https://data.brla.gov/Government/City-Parish-Employee-Annual-Salaries/g5c2-myyj","CSV","https://data.brla.gov/terms-of-service",,"Employee names, salaries, positions/titles and other pay-related information","City-Parish Finance Department","Yes","Yes",,"City-Parish employees' annual salaries and other payroll related information. Information is calculated after the last payroll is run for the year specified.","Yes","Yes","anonymous","anonymous","100"
"3e0a8bf2-ba47-4e70-9819-a194e7913350","us-city","2016-03-10T23:06:50","2016","batonrouge","transit","Yes","Yes","Yes","Yes","Yes","No","No",,"Yes","http://m.routeshout.com/",,,,"Data includes when the next CATS bus is coming and is accessible from any mobile phone, which allows users to view bus arrival times, route and stop information. ","Capital Area Transit System (CATS)","Yes","Yes",,"The CATS RouteShout mobile application allow users to know when the next bus is coming from any mobile phone and view bus arrival times, route and stop information. CATS bus routes and schedules are posted online at http://www.brcats.com/routes-schedules, and a real-time, web-based map with text alerts showing the location of CATS buses is available at http://98.164.132.99/portal/fr2/index.jsf. ","Yes","No","anonymous","anonymous","45"
"e7d534cb-cb63-4975-81d0-04f760ef98b8","us-city","2016-05-14T16:18:35","2016","sanfrancisco","food-safety","Yes","Yes","Yes","Yes","Yes","Yes","Yes",,"Yes","https://data.sfgov.org/Health-and-Social-Services/Food-Inspections-LIVES-Standard/pyih-qa8i","CSV, XML, API, JSON, PDF, EXCEL","http://opendatacommons.org/licenses/pddl/1.0/",,"Food Inspections - LIVES Standard","Department of Public Health","Yes","Yes",,"The Health Department has developed an inspection report and scoring system. After conducting an inspection of the facility, the Health Inspector calculates a score based on the violations observed. Violations can fall into:high risk category: records specific violations that directly relate to the transmission of food borne illnesses, the adulteration of food products and the contamination of food-contact surfaces.moderate risk category: records specific violations that are of a moderate risk to the public health and safety.low risk category: records violations that are low risk or have no immediate risk to the public health and safety.The score card that will be issued by the inspector is maintained at the food establishment and is available to the public in this dataset. 

San Francisco's LIVES restaurant inspection data leverages the LIVES Flattened Schema (https://goo.gl/c3nNvr), which is based on LIVES version 2.0, cited on Yelp's website (http://www.yelp.com/healthscores).

Export in one of many formats (csv, xls, xml, JSON, pdf) via the 'export' button. This dataset is also Socrata API-enabled, for easy, custom-aggregated, and/or custom-filtered application consumption.

For more info on using the Socrata API, visit: https://dev.socrata.com/foundry/data.sfgov.org/sipz-fjte","Yes","Yes","Jude Calvillo","Jude Calvillo","100"
"a8b03b06-0e45-469b-9334-e279c0834d45","us-city","2016-05-14T16:00:02","2016","sanfrancisco","construction-permits","Yes","Yes","Yes","Yes","Yes","Yes","Yes",,"Yes","https://data.sfgov.org/Housing-and-Buildings/San-Francisco-Development-Pipeline-2016-Quarter-1/dtz9-jkjt","CSV, XML, API, JSON, PDF, EXCEL","http://opendatacommons.org/licenses/pddl/1.0/",,"San Francisco Development Pipeline 2016 Quarter 1. Snapshot of San Francisco Development Pipeline. Tracking of construction and entitlement activity... see details.","SF Planning","Yes","Yes",,"Snapshot of San Francisco Development Pipeline. Tracking of construction and entitlement activity based on data from Dept of Building Inspection's Permit Tracking and the Planning Department's Case Tracking enterprise databases, processed quarterly.

Export in one of many formats (csv, xls, xml, JSON, pdf) via the 'export' button. This dataset is also Socrata API-enabled, for easy, custom-aggregated, and/or custom-filtered application consumption.

For more info on this San Francisco department, visit: http://www.sf-planning.org/index.aspx?page=1691

For more info on using the Socrata API, visit: https://dev.socrata.com/foundry/data.sfgov.org/6iid-qfaz","Yes","Yes","Jude Calvillo","Jude Calvillo","100"
"c3dfc13e-ada1-4f21-a8ce-57c7fa18ac22","us-city","2016-05-14T15:51:41","2016","sanfrancisco","zoning","Yes","Yes","Yes","Yes","Yes","Yes","Yes",,"Yes","https://data.sfgov.org/Geographic-Locations-and-Boundaries/Zoning-Districts/mici-sct2","shapefiles (zipped)","http://opendatacommons.org/licenses/pddl/1.0/",,"The Zoning Districts are a component of the Zoning Map which in turn is a key component of the San Francisco Planning Code. The data is available in GIS Shapefile format.","City and County of San Francisco Planning Department","Yes","Yes",,"The Zoning Districts are a component of the Zoning Map which in turn is a key component of the San Francisco Planning Code. The data is available in GIS Shapefile format. The .dbf file can be opened in Excel, Access or other spreadsheet or database programs.The official Zoning Map can be found in the San Francisco Planning Code: http://planningcode.sfplanning.org(click on the links under ZONING MAPS on the left navigation column).A PDF map of the Zoning Districts can be found on the Planning Department's Map LibrarySummaries of the Zoning District codes can be found here:http://www.sf-planning.org/index.aspx?page=1580 Data dictionary can be found in the .xml file within the zip","Yes","Yes","Jude Calvillo","Jude Calvillo","100"
"e6b28891-c21e-42e1-9f96-c6356a58dcc9","us-city","2016-05-14T15:46:22","2016","sanfrancisco","parcels","Yes","Yes","Yes","Yes","Yes","Yes","Yes",,"Yes","https://data.sfgov.org/Geographic-Locations-and-Boundaries/City-Lots-Zipped-Shapefile-Format-/3vyz-qy9p","shapefiles (zipped)","http://creativecommons.org/publicdomain/zero/1.0/legalcode",,"City Lots (Zipped Shapefile). The CityLots spatial data layer is a representation of the City and County of San Francisco's Subdivision parcels.","Technology / SF GIS","Yes","Yes",,"The CityLots spatial data layer is a representation of the City and County of San Francisco's Subdivision parcels and is updated nightly. Each of the 200,000-plus polygons has a unique BLKLOT identifier which is the Assessor Parcel Number (APN) Multiple level (condominium, live/work, et al) lots are represented as well, with their ground or base lot being the MAPBLKLOT key.","Yes","Yes","Jude Calvillo","Jude Calvillo","100"
