"id","site","timestamp","year","place","dataset","exists","digital","public","online","free","machinereadable","bulk","openlicence","uptodate","url","format","licenseurl","dateavailable","officialtitle","publisher","reviewed","reviewResult","reviewComments","details","isCurrent","isOpen","submitter","reviewer","score"
"2e3b0549-b46e-444c-b6c9-20d698256317","us-city","2015-08-27T20:57:14","2015","washingtondc","asset-disclosure","Unsure","Unsure","Unsure","Unsure","Unsure","Unsure","Unsure",,"Unsure",,,,,,,"Yes","Yes",,"Dataset is called ""Conflicts of Interest (FDS)"" Licensing is unclear via the Board of Ethics and Government Accountability site. 

Link to site https://efiling.bega.dc.gov/imaging/searchImages.asp doesn't seem to work. 

This online data set does not include the data required in the description: 

""Top-level government officials’ financial assets, including: name of top-level government officials, title, investment information, prior and current business relationships, real estate interests, and personal income (including gifts and travel or speaking payments).""
","Yes","No","Michael Schnuerle","Michael Schnuerle","0"
"2dc5b476-6192-41fc-8309-f994ceb4c0c7","us-city","2015-08-27T20:55:29","2015","atlanta","asset-disclosure","Unsure","Unsure","Unsure","Unsure","Unsure","Unsure","Unsure",,"Unsure",,,,,,,"Yes","Yes",,"PDF has information but is interspersed with summaries and legal notices. Not in tabular format.

This online data set does not include the data required in the description: 

""Top-level government officials’ financial assets, including: name of top-level government officials, title, investment information, prior and current business relationships, real estate interests, and personal income (including gifts and travel or speaking payments).""
","Yes","No","Michael Schnuerle","Michael Schnuerle","0"
"158da0e1-6b02-4fe9-b97d-e704fe87992d","us-city","2015-08-27T20:55:20","2015","athensga","asset-disclosure","Unsure","Unsure","Unsure","Unsure","Unsure","Unsure","Unsure",,"Unsure",,,,,,,"Yes","Yes",,"This online data set does not include the data required in the description: 

""Top-level government officials’ financial assets, including: name of top-level government officials, title, investment information, prior and current business relationships, real estate interests, and personal income (including gifts and travel or speaking payments).""
","Yes","No","Michael Schnuerle","Michael Schnuerle","0"
"22057989-18c9-49ab-bdfd-3d24f4d3f1d5","us-city","2015-08-27T20:44:30","2015","sacramento","asset-disclosure","Unsure","Unsure","Unsure","Unsure","Unsure","Unsure","Unsure",,"Unsure",,,,,,,"Yes","Yes",,"This online data set does not include the data required in the description: 

""Top-level government officials’ financial assets, including: name of top-level government officials, title, investment information, prior and current business relationships, real estate interests, and personal income (including gifts and travel or speaking payments).""

It only includes salaries, wages, overtime, retirement, health costs, etc.","Yes","No","Michael Schnuerle","Michael Schnuerle","0"
"36c2b0a7-6c3d-438a-92ef-2fe8914f5c22","us-city","2015-04-13T19:05:46","2015","philly","asset-disclosure","Yes","Yes","Yes","Yes","Yes","No","No",,"No","http://fdswebsearch.phila-records.com/",,,,,"Board of Ethics, Chief Integrity Officer","Yes","Yes","Edited description to remove ""available in the future"" note - spoke to local gov't staff to clarify that future submissions have to wait till the data is actually available. (By time of review, it was available)",,"Yes","No","Stacey Mosley","Ben Novack","35"
"decdb661-8153-4080-8a44-be4b35b7d288","us-city","2015-08-27T20:31:36","2015","sanfrancisco","asset-disclosure","Unsure","Unsure","Unsure","Unsure","Unsure","Unsure","Unsure",,"Unsure",,,,,,,"Yes","Yes",,"Public employee pay. Was looking for elected official financial reports.

This online data set does not include the data required in the description: 

""Top-level government officials’ financial assets, including: name of top-level government officials, title, investment information, prior and current business relationships, real estate interests, and personal income (including gifts and travel or speaking payments).""

Not sure if all of this even exists in one place in digital or non-digital formats for any US city government's employees.","Yes","No","Michael Schnuerle","Michael Schnuerle","0"
"e6dea66b-274b-41f1-bc40-b40481777df7","us-city","2015-08-25T18:36:05","2015","seattle","budget","Yes","Yes","Yes","Yes","Yes","Yes","Yes",,"Yes","https://data.seattle.gov/browse?Data-Owner_Owner=City+Budget+Office&utf8=%E2%9C%93&sortBy=newest","HTML","https://data.seattle.gov/data-policy",,,"City Budget Office","Yes","Yes",,"Yearly budges are posted as new datasets, hindering automated consumption of new data as it becomes available.  Archives previous to 2010 are available only in pdf format: http://www.seattle.gov/financedepartment/budgetarchives.htm

NOTE: Data refactoring into a single data set is on the work plan for 2015.","Yes","Yes","Seth Vincent","Seth Vincent","100"
"b80ab3b1-0052-49eb-be88-d8b48e64568c","us-city","2015-01-04T08:34:02","2015","sacramento","spending","Yes","Yes","Yes","Yes","Yes","Yes","Yes",,"Yes","http://data.cityofsacramento.org/datastreams/79807/checks-issued/","CSV, XLS, XLSx, google spreadsheet","http://portal.cityofsacramento.org/~/media/Files/OpenData/OpenDataTermsOfUse.ashx",,,"City of Sacramento","Yes","Yes","Looks good.","Quality of data content: check number, issue date, payee name, amount. No data regarding why the payee is being paid. 
Quality of data structure: provided for download in multiple useful formats, website allows ordering for greatest to least and reverse. 
Filtering and sorting is available now.  data is published on a weekly basis","Yes","Yes","anonymous","Code for Sacramento","100"
"7f0dd14a-c3ec-4da3-bd3b-e835c24546e6","us-city","2015-01-04T08:29:07","2015","sacramento","lobbyist","Yes","Yes","Yes","Yes","Yes","Yes","Yes",,"Yes","http://data.cityofsacramento.org/datastreams/82825/lobbyist-report/","json","http://portal.cityofsacramento.org/opendata",,,"City of Sacramento","Yes","Yes","Looks good.","City of Sacramento is publishing the data automatically to the open data portal every month","Yes","Yes","anonymous","Code for Sacramento","100"
"e835cae0-93fc-486c-b366-95dae55dd243","us-city","2015-08-06T17:43:39","2015","seattle","web-analytics","Yes","Yes","Yes","Yes","Yes","Yes","Yes",,"Yes","https://data.seattle.gov/City-Business/City-of-Seattle-Webstats-Pageviews-by-top-level-do/5nzb-2wmf","CSV","https://wiki.creativecommons.org/wiki/Public_domain",,"City of Seattle Webstats - Pageviews by top level domains","City of Seattle - Dept of Information Technology - webmaster@seattle.gov","Yes","Yes",,"Google Analytics counts for *.seattle.gov domains, non seattle.gov domains managed by the city are added in as the numbers are available.","Yes","Yes","Nate Eckstine","Nate Eckstine","100"
"c6fb6f89-aed8-4b14-a44d-7dcb3f78f3ca","us-city","2015-08-19T16:29:47","2015","kansascitymo","construction-permits","Yes","Yes","Yes","Yes","Yes","Unsure","Yes",,"Yes","http://kivaweb.kcmo.org/kivanet/2/permit/index.cfm?http://kivaweb.kcmo.org/kivanet/2/permit/index.cfm?",,"http://kcmo.gov/planning/online-tools-and-resources/http://kcmo.gov/planning/online-tools-and-resources/",,"KIVA Enterprise Permitting System","City of Kansas City ","Yes","Yes",,"The current enterprise permitting system is KIVA. This system will be replaced by Energov in the future. Energov will allow for tabular data to be exported. Kansas City anticipates hosting Energov data on Open Data KC (Data.kcmo.gov) when Energov is implemented. ","Yes","No","Eric Roche","Eric Roche","85"
"d6cebc44-a7ab-4d6b-accc-f7b2e0deae6e","us-city","2015-08-19T16:19:43","2015","kansascitymo","service-requests","Yes","Yes","Yes","Yes","Yes","Yes","Yes",,"Yes","https://data.kcmo.org/311/311-Call-Center-Service-Requests/7at3-sxhp","Excel, CSV, JSON, RDF, RSS, XLS, XLSX, XML","http://kcmo.org/CKCMO/LegalNotice/index.htm",,"311 Call Center Service Requests","Eric.Roche Eric.Roche@kcmo.org","Yes","Yes",,"Data is good, but the data set lacks a description of the request and history, but does contain a case id that can be used to look it up in another system.  KCMO is working on providing easier access to the description of the request and history.
Formats are CSV, JSON, PDF, RDF, RSS, XLS, XLSX, XML","Yes","Yes","Eric Roche","Eric Roche","100"
"fb44def6-9ff4-4d39-a0ec-82061d636095","us-city","2015-08-15T23:33:07","2015","tuscaloosa","parcels","Yes","Yes","Yes","Yes","Yes","No","No",,"Yes","http://tuscaloosa.maps.arcgis.com/apps/OnePane/basicviewer/index.html?appid=c55d7c8b6c5d4df8877a2c7b03710d5e/",,,,,"City of Tuscaloosa","Yes","Yes",,"You can view the GIS files through a web interface, but you can't download them. Links to other GIS datasets are available here: http://tuscgis.tuscaloosa-al.gov/disclaimer/disclaimer.htm.","Yes","No","Matthew Leeds","Matthew Leeds","45"
"f3076497-f51b-472c-b94b-cdb4e6483669","us-city","2015-08-15T22:50:10","2015","tuscaloosa","business-listings","Yes","Yes","Yes","Yes","Yes","No","No",,"Yes","http://www.sos.alabama.gov/vb/inquiry/inquiry.aspx?area=Business%20Entity",,,,,"Alabama Secretary of State","Yes","Yes",,,"Yes","No","Matthew Leeds","Matthew Leeds","45"
"bf3c6bfc-207a-4653-a439-d7c7e80eaa70","us-city","2015-08-15T22:45:28","2015","tuscaloosa","service-requests","Unsure","Unsure","Unsure","Unsure","Unsure","Unsure","Unsure",,"Unsure",,,,,,,"Yes","Yes",,"http://www.tuscaloosa.com/Government/Departments/City%20Clerk/tuscaloosa311","Yes","No","Matthew Leeds","Matthew Leeds","0"
"443fbba0-e69c-42e0-86de-e2e9f7c82d8b","us-city","2015-08-15T22:44:37","2015","tuscaloosa","transit","Yes","Yes","Yes","Yes","Yes","No","No",,"Unsure","http://www.tuscaloosatransit.com/routeInfo.php",,,,,"Tuscaloosa Transit Authority ","Yes","Yes",,"routes and schedules available in pdf form. ","Yes","No","Tait Wayland","Tait Wayland","35"
"08349fd8-86e2-4548-8f66-fbfb2fe6602b","us-city","2015-08-15T22:38:39","2015","tuscaloosa","crime-stats","Yes","Yes","Yes","Yes","Yes","No","No",,"No","https://www.crimereports.com/",,,,,"Tuscaloosa Police Department","Yes","Yes",,"middleman service of crime data. Direct data not available from city. ","Yes","No","Tait Wayland","Tait Wayland","35"
"db2ba2a7-6584-4687-aa36-1378e921dde9","us-city","2015-08-15T17:37:40","2015","tuscaloosa","campaign-finance","Yes","Yes","Yes","Yes","Yes","Yes","Yes",,"Yes","http://fcpa.alabamavotes.gov/PublicSite/DataDownload.aspx","CSV",,,"Expenditures and Contributions to and from political candidates and PACs","Alabama Secretary of State","Yes","Yes",,,"Yes","No","Matthew Leeds","Matthew Leeds","70"
"c9981e53-c7da-4b0f-8e01-c811e8181939","us-city","2015-08-15T17:30:52","2015","tuscaloosa","spending","Yes","Yes","Yes","Yes","Yes","No","Yes",,"Yes","http://www.tuscaloosa.com/Government/Departments/Finance/financial-reports",,,,,"City of Tuscaloosa Department of Finance","Yes","Yes",,"The data is in PDF format, with tables interspersed with text descriptions. It's not as granular as it could be, but it does show specific groups they give money to, not just categories of spending.","Yes","No","Matthew Leeds","Matthew Leeds","55"
"6e0c515f-ae2e-42db-a10c-05b71ebe26f9","us-city","2015-08-15T17:02:37","2015","tuscaloosa","zoning","Yes","Yes","Yes","Yes","Yes","No","No",,"Yes","http://tuscaloosa.maps.arcgis.com/apps/OnePane/basicviewer/index.html?appid=c55d7c8b6c5d4df8877a2c7b03710d5e/",,,,,"City of Tuscaloosa GIS Division","Yes","Yes","This provides a helpful link.","You can view the GIS files through a web interface, but you can't download them. Links to other GIS datasets are available here: http://tuscgis.tuscaloosa-al.gov/disclaimer/disclaimer.htm.","Yes","No","Matthew Leeds","Matthew Leeds","45"
"2ccfd32b-d92e-4b63-9fbb-033de498ed0e","us-city","2015-08-14T14:56:47","2015","philly","campaign-finance","Yes","Yes","Yes","Yes","Yes","Yes","Yes",,"Yes","https://github.com/CityOfPhiladelphia/phl-campaign-finance-data","CSV","https://github.com/CityOfPhiladelphia/terms-of-use/blob/master/LICENSE.md",,,"Department of Records","Yes","Yes",,"Also available in a searchable application https://phila-records.com/campaign-finance/web/","Yes","Yes","Anconaauren L","Anconaauren L","100"
"cbf7da62-3b4e-4f2b-bbd1-4f0b147cf53d","us-city","2015-08-13T19:06:19","2015","denver","zoning","Yes","Yes","Yes","Yes","Yes","Yes","Yes",,"Yes","http://data.denvergov.org/dataset/city-and-county-of-denver-zoning","shapefiles","http://data.denvergov.org/termsofuse",,"Zoning - This layer represents the zoning boundaries for the City and County of Denver, Colorado. The zoning boundaries data layer is governed by ordinance and is only changed accordingly.","City and County of Denver, Technology Services / Enterprise Data Management - denvergis@denvergov.org","Yes","Yes",,,"Yes","Yes","anonymous","anonymous","100"
"26e50d67-87cf-40cf-a28f-2bc6837e213d","us-city","2015-08-13T18:20:37","2015","denver","campaign-finance","Yes","Yes","Yes","Yes","Yes","Yes","Yes",,"Yes","http://data.denvergov.org/dataset/city-and-county-of-denver-campaign-finance-reports","CSV","http://data.denvergov.org/termsofuse",,"City and County of Denver:Campaign Finance Reports",,"Yes","Yes",,"Data appears complete, but no info on publisher of data or contact details.","Yes","Yes","anonymous","anonymous","100"
"2f04da47-b88f-41c3-9474-892a067c5153","us-city","2015-08-13T18:07:13","2015","denver","budget","Yes","Yes","Yes","Yes","Yes","No","Yes",,"No","http://data.denvergov.org/search?q=budget",,"http://data.denvergov.org/termsofuse",,"2013 Budget - The City and County of Denver's 2013 budget provides detailed information about estimated revenues and expenditures for the fiscal year. The budget also serves as a work plan for the City and its departments, including a framework for setting priorities, strategic initiatives and performance measures.","City and County of Denver Budget and Management Office","Yes","Yes",,"Only pdfs available from 2011-2013 (as of August 2015)","Yes","No","anonymous","anonymous","75"
"d14dbff7-32f1-4e1b-a739-92c94e03eae5","us-city","2015-08-13T18:03:40","2015","denver","parcels","Yes","Yes","Yes","Yes","Yes","Yes","Yes",,"Yes","http://data.denvergov.org/dataset/city-and-county-of-denver-parcels","shapefiles","http://data.denvergov.org/termsofuse",,"Parcels - Parcels within the City and County of Denver as they are represented graphically.","City and County of Denver – Department of Finance / Assessment Division / GIS Section - denvergis@denvergov.org","Yes","Yes",,"Data updated extremely recently, but would be ideal to be able to access previous versions of parcel boundaries.","Yes","Yes","anonymous","anonymous","100"
"c2757433-32ea-45e7-af70-cd2023463f89","us-city","2015-08-13T17:49:48","2015","denver","service-requests","Yes","Yes","Yes","Yes","Yes","Yes","Unsure",,"Unsure","http://data.denvergov.org/dataset/city-and-county-of-denver-311-service-requests","C",,,"311 Service Requests - current data and previous 12 months.","City and County of Denver","Yes","Yes",,,"Yes","No","Hanna Camp","Hanna Camp","50"
"4474b2ee-580d-4fe0-ae3a-2c3ce5f8683f","us-city","2015-08-13T17:06:27","2015","denver","contracts","Yes","Yes","Yes","Yes","Yes","Yes","Yes",,"Yes","http://data.denvergov.org/dataset/city-and-county-of-denver-checkbook","CSV","http://data.denvergov.org/termsofuse",,"Checkbook - This dataset includes accounts payable payments made to vendors by the City and County of Denver for the previous five calendar years plus the current year to date. The checkbook dataset is refreshed each day with the previous business day’s transactions. Procurement and travel data is accessible through the Procurement and Travel data sets.","Department of Finance - AccountsPayable.help@denvergov.org","Yes","Yes",,"Data does not include great detail on what was purchased in each transaction record.

Official Disclaimer from City:

The City and County of Denver is committed to the highest levels of data security and privacy, therefore not all payment transactions will be displayed. Payment transactions that are confidential are excluded from the data. Protected information such as social security numbers, banking information, and personal data are excluded from payment transaction details. The data contained on this website is unaudited and is for informational purposes only. It is not the intent of the site to provide information that may be used to determine or influence the financial decisions of any website user.","Yes","Yes","anonymous","anonymous","100"
"47a639d0-e126-4add-95e0-b8358bce98a0","us-city","2015-08-12T14:39:34","2015","dallas","food-safety","Yes","Yes","Yes","Yes","Yes","No","No",,"Yes","http://www2.dallascityhall.com/FoodInspection/SearchScores.cfm",,,,"Food Inspection Scores","City of Dallas","Yes","Yes",,,"Yes","No","CIS Webgroup","CIS Webgroup","45"
"e2590bfd-840d-4f0e-98fd-8d1137a56fc5","us-city","2015-08-12T01:50:02","2015","albuquerque","assessment","Yes","No","No","No","No","No","No",,"No",,,,,,,"Yes","Yes",,,"Yes","No","Melo King","Code4ABQ Brigade","5"
"69f83a1a-dd62-4025-8668-500cfb90a1e4","us-city","2015-08-10T19:01:33","2015","culvercity","assessment","Yes","Yes","Yes","Yes","Yes","Yes","Yes",,"Yes","https://data.lacounty.gov/Parcel-/Assessor-Parcels-Data/kbm6-eaaf","CSV, CSV for Excel, JSON, PDF, RDF, RSS, XLS, XLSX, XML","https://data.lacounty.gov/Parcel-/Assessor-Parcels-Data/kbm6-eaaf/about",,"Assessor Parcels Data - 2014: Valuation and property description for parcels on the Assessor's annual secured assessment roll for 2014. This dataset excludes Cross Reference Roll (89xx-series AssessorID).","LA County Assessor","Yes","Yes","Approved as submitted ",,"Yes","Yes","Andrew Frantela","Brett Shears","100"
"0691314e-9e19-4d46-9db3-9ab0d80920b4","us-city","2015-08-10T19:18:46","2015","westcovina","assessment","Yes","Yes","Yes","Yes","Yes","Yes","Yes",,"Yes","https://data.lacounty.gov/dataset/Terms-of-Use/7d57-yb6q?","CSV, JSON, PDF, RDF, RSS, XLS, XLSX, XML","https://data.lacounty.gov/dataset/Terms-of-Use/7d57-yb6q?/about",,"Assessor Parcels Data - 2014: Valuation and property description for parcels on the Assessor's annual secured assessment roll for 2014. This dataset excludes Cross Reference Roll (89xx-series AssessorID).","LA County Office of the Assessor","Yes","Yes","Approved with addition of title and short description. ",,"Yes","Yes","Andrew Frantela","Brett Shears","100"
"189796f1-75cc-4f5c-b801-7b884e7365ed","us-city","2015-08-10T19:31:35","2015","westcovina","food-safety","Yes","Yes","Yes","Yes","Yes","Yes","Yes",,"Yes","https://data.lacounty.gov/Public-Health/2014-Restaurants-And-Markets-Violations/kbia-7mpx","CSV, JSON, PDF, RDF, RSS, XLS, XLSX, XML","https://data.lacounty.gov/Public-Health/2014-Restaurants-And-Markets-Violations/kbia-7mpx/about",,"2014 Restaurants And Markets Violations: This dataset contains Environmental Health Inspection Results for Restaurants and Markets in Los Angeles County for 2014.","LA County Office of Public Health","Yes","Yes","Approved with title and description added. ",,"Yes","Yes","Andrew Frantela","Brett Shears","100"
"eef6be91-3e68-4a24-b92c-cd5aafa2d44c","us-city","2015-08-03T17:42:59","2015","longbeachca","food-safety","No","No","No","No","No","No","No",,"No","https://data.lacounty.gov/Public-Health/2014-Restaurants-And-Markets-Violations/kbia-7mpx","CSV, CSV for Excel, JSON, PDF, RDF, RSS, XLS, XLSX, XML","https://data.lacounty.gov/Public-Health/2014-Restaurants-And-Markets-Violations/kbia-7mpx/about",,"2014 Restaurants And Markets Violations: This dataset contains Environmental Health Inspection Results for Restaurants and Markets in Los Angeles County for 2014.","LA County Environmental Health Department","Yes","Yes","Approved as submitted. ","Long Beach has it's own Health Department separate from LA County, so they do not get credit for LA County Restaurant Inspection data. Long Beach only has restaurant closures (due to inspection) available on their website. ","Yes","No","Andrew Frantela","Brett Shears","0"
"c1bed611-da0f-464c-858c-bf2dfe46b563","us-city","2015-08-03T18:16:54","2015","westcovina","deeds","Yes","Yes","Yes","Yes","Yes","Yes","Yes",,"Yes","https://data.lacounty.gov/Parcel-/Assessor-Parcels-Data/kbm6-eaaf","CSV, CSV for Excel, JSON, PDF, RDF, RSS, XLS, XLSX, XML","https://data.lacounty.gov/Parcel-/Assessor-Parcels-Data/kbm6-eaaf/about",,"Assessor Parcels Data - 2014: Valuation and property description for parcels on the Assessor's annual secured assessment roll for 2014. This dataset excludes Cross Reference Roll (89xx-series AssessorID).","LA County Assessor's Office ","Yes","Yes","Approved with addition of title, short description, and data formats. ","LA County Office of the Assessor -- http://assessor.lacounty.gov/extranet/Outsidesales/online.aspx","Yes","Yes","Andrew Frantela","Brett Shears","100"
"43d89c93-ffe4-4d52-95d6-453d4a541371","us-city","2015-08-03T17:55:47","2015","elsegundo","assessment","Yes","Yes","Yes","Yes","Yes","Yes","Yes",,"Yes","http://maps.assessor.lacounty.gov/mapping/viewer.asphttps://data.lacounty.gov/Parcel-/Assessor-Parcels-Data/kbm6-eaaf","CSV, JSON, PDF, RDF, RSS, XLS, XLSX, XML","https://data.lacounty.gov/Parcel-/Assessor-Parcels-Data/kbm6-eaaf/about",,"Assessor Parcels Data - 2014: Valuation and property description for parcels on the Assessor's annual secured assessment roll for 2014. This dataset excludes Cross Reference Roll (89xx-series AssessorID).","LA County Office of the Assessor","Yes","Yes","Approved with addition of title and short description.",,"Yes","Yes","Andrew Frantela","Brett Shears","100"
"a1ead1cb-fde6-4043-9f92-84ae04e1e3ce","us-city","2015-08-03T17:55:19","2015","elsegundo","food-safety","Yes","Yes","Yes","Yes","Yes","Yes","Yes",,"Yes","https://data.lacounty.gov/Public-Health/2014-Restaurants-And-Markets-Violations/kbia-7mpx","CSV, JSON, PDF, RDF, RSS, XLS, XLSX, XML","https://data.lacounty.gov/Public-Health/2014-Restaurants-And-Markets-Violations/kbia-7mpx/about",,"2014 Restaurants And Markets Violations: This dataset contains Environmental Health Inspection Results for Restaurants and Markets in Los Angeles County for 2014.","LA County Office of Public Health","Yes","Yes","Approved with addition of title and short description.",,"Yes","Yes","Andrew Frantela","Brett Shears","100"
"01264a6c-d229-4acd-925c-8bbb792ffed5","us-city","2015-08-03T17:54:53","2015","elsegundo","deeds","Yes","Yes","Yes","Yes","Yes","Yes","Yes",,"Yes","https://data.lacounty.gov/Parcel-/Assessor-Parcels-Data/kbm6-eaaf","CSV, JSON, PDF, RDF, RSS, XLS, XLSX, XML","https://data.lacounty.gov/Parcel-/Assessor-Parcels-Data/kbm6-eaaf/about",,"Assessor Parcels Data - 2014: Valuation and property description for parcels on the Assessor's annual secured assessment roll for 2014. This dataset excludes Cross Reference Roll (89xx-series AssessorID).","LA County Assessor's Office ","Yes","Yes","Approved with addition of title and short description.",,"Yes","Yes","Andrew Frantela","Brett Shears","100"
"d74aee5a-60ba-45a3-979b-af7b112ae293","us-city","2015-08-03T17:58:45","2015","calabasas","assessment","Yes","Yes","Yes","Yes","Yes","Yes","Yes",,"Yes","https://data.lacounty.gov/Parcel-/Assessor-Parcels-Data/kbm6-eaaf","CSV, CSV for Excel, JSON, PDF, RDF, RSS, XLS, XLSX, XML","https://data.lacounty.gov/Parcel-/Assessor-Parcels-Data/kbm6-eaaf/about",,"Assessor Parcels Data - 2014: Valuation and property description for parcels on the Assessor's annual secured assessment roll for 2014. This dataset excludes Cross Reference Roll (89xx-series AssessorID).","LA County Assessor's Office ","Yes","Yes","Approved with addition of title, short description, and data formats. ",,"Yes","Yes","Andrew Frantela","Brett Shears","100"
"1bfc13c8-0b05-4c3a-bacf-757622d68d65","us-city","2015-08-03T17:58:01","2015","calabasas","food-safety","Yes","Yes","Yes","Yes","Yes","Yes","Yes",,"Yes","https://data.lacounty.gov/Public-Health/2014-Restaurants-And-Markets-Violations/kbia-7mpx","CSV, JSON, PDF, RDF, RSS, XLS, XLSX, XML","https://data.lacounty.gov/Public-Health/2014-Restaurants-And-Markets-Violations/kbia-7mpx/about",,"2014 Restaurants And Markets Violations: This dataset contains Environmental Health Inspection Results for Restaurants and Markets in Los Angeles County for 2014.","LA County Office of Public Health","Yes","Yes","Approved with addition of title and short description.",,"Yes","Yes","Andrew Frantela","Brett Shears","100"
"462ce663-2e0e-45a7-98c9-0f16975157b3","us-city","2015-08-03T17:57:20","2015","calabasas","deeds","Yes","Yes","Yes","Yes","Yes","Yes","Yes",,"Yes","https://data.lacounty.gov/Parcel-/Assessor-Parcels-Data/kbm6-eaaf","CSV, CSV for Excel, JSON, PDF, RDF, RSS, XLS, XLSX, XML","https://data.lacounty.gov/Parcel-/Assessor-Parcels-Data/kbm6-eaaf/about",,"Assessor Parcels Data - 2014: Valuation and property description for parcels on the Assessor's annual secured assessment roll for 2014. This dataset excludes Cross Reference Roll (89xx-series AssessorID).","LA County Assessor's Office ","Yes","Yes","Approved with addition of title, short description, and data formats. ",,"Yes","Yes","Andrew Frantela","Brett Shears","100"
